CENTRO_FORMACION,CODIGO_CENTRO,LATITUD,LONGITUD,GEORREFERENCIACION,NOMBRE_REGIONAL,CODIGO_REGIONAL,NOMBRE_DEPARTAMENTO,CODIGO_DEPARTAMENTO,NOMBRE_MUNICIPIO,CODIGO_MUNICIPIO,LATITUD_norm,LONGITUD_norm,distancia_bog,cluster
CENTRO DE LOS RECURSOS NATURALES RENOVABLES - LA SALADA,9101,6.053527,-75.62891,POINT (-75.62891 6.053527),5,REGIONAL ANTIOQUIA,ANTIOQUIA,5,MEDELLIN,1,0.1777710568038037,-0.4740325213900654,2.055808233719528,2
CENTRO PARA EL DESARROLLO AGROECOLOGICO Y AGROINDUSTRIAL,9103,10.98772,-74.78277,POINT (-74.78277 10.98772),8,REGIONAL ATLANTICO,ATLANTICO,8,BARRANQUILLA,1,1.8369061792046144,-0.0833848073182887,6.316835279734622,1
CENTRO AGROEMPRESARIAL Y MINERO,9104,10.373,-75.461,POINT (-75.461 10.373),13,REGIONAL BOLIVAR,BOLIVAR,13,CARTAGENA,1,1.6302049937337126,-0.3965114756177417,5.829885504879146,1
CENTRO DE DESARROLLO AGROPECUARIO Y AGROINDUSTRIAL,9110,5.82556,-73.02979,POINT (-73.02979 5.82556),15,REGIONAL BOYACA,BOYACA,15,TUNJA,1,0.1011165650868512,0.7259347258718883,1.5259245321115964,2
CENTRO PARA LA FORMACION CAFETERA,9112,5.0329,-75.4506,POINT (-75.4506 5.0329),17,REGIONAL CALDAS,CALDAS,17,MANIZALES,1,-0.1654174043225796,-0.3917099815076085,1.415682722222736,2
CENTRO AGROPECUARIO,9113,2.4403,-76.6128,POINT (-76.6128 2.4403),19,REGIONAL CAUCA,CAUCA,19,POPAYAN,1,-1.0371858410935657,-0.9282769483147746,3.4076007879444963,0
CENTRO BIOTECNOLOGICO DEL CARIBE,9114,10.3989,-73.23897,POINT (-73.23897 10.3989),20,REGIONAL CESAR,CESAR,20,VALLEDUPAR,1,1.6389139355343638,0.6293600587606188,5.748577684166754,1
CENTRO AGROINDUSTRIAL DEL META,9117,4.062,-73.51457,POINT (-73.51457 4.062),50,REGIONAL META,META,50,VILLAVICENCIO,1,-0.4918850334442914,0.5021204648421356,0.8555286113859641,2
CENTRO ACUICOLA Y AGROINDUSTRIAL DE GAIRA,9118,11.18334,-74.21667,POINT (-74.21667 11.18334),47,REGIONAL MAGDALENA,MAGDALENA,47,SANTA MARTA,1,1.90268390874297,0.1779734441956849,6.4739566328868765,1
CENTRO DE FORMACION PARA EL DESARROLLO RURAL Y MINERO,9119,7.8993,-73.51457,POINT (-73.51457 7.8993),54,REGIONAL NORTE DE SANTANDER,NORTE DE SANTANDER,54,CUCUTA,1,0.7984169886267204,0.5021204648421356,3.236662647682022,2
CENTRO AGROINDUSTRIAL,9120,4.568,-75.651,POINT (-75.651 4.568),63,REGIONAL QUINDIO,NARINO,52,SAN PABLO,693,-0.3217412283813745,-0.4842310795528307,1.5854620777552453,2
CENTRO ATENCION SECTOR AGROPECUARIO,9121,4.8144,-75.7007,POINT (-75.7007 4.8144),66,REGIONAL RISARALDA,RISARALDA,66,PEREIRA,1,-0.2388885928724756,-0.507176681213747,1.6319789367513244,2
CENTRO ATENCION SECTOR AGROPECUARIO,9122,6.99189,-73.0686,POINT (-73.0686 6.99189),68,REGIONAL SANTANDER,CORDOBA,23,MONTERIA,1,0.4932980357568751,0.7080168425628321,2.491840836028657,2
CENTRO AGROPECUARIO LA GRANJA,9123,4.171,-74.929,POINT (-74.929 4.171),73,REGIONAL TOLIMA,TOLIMA,73,IBAGUE,1,-0.4552335023141373,-0.1508965845994911,1.01294076825844,2
CENTRO AGROPECUARIO DE BUGA,9124,3.614127,-76.27486,POINT (-76.27486 3.614127),76,REGIONAL VALLE,ATLANTICO,8,SOLEDAD,758,-0.6424834848374613,-0.7722560906630725,2.4608377755815205,0
CENTRO LATINOAMERICANO DE ESPECIES MENORES,9125,4.0456,-76.204,POINT (-76.204 4.0456),76,REGIONAL VALLE,VALLE DEL CAUCA,76,CALI,1,-0.4973995757427733,-0.739541295216539,2.23342364096021,0
CENTRO NAUTICO PESQUERO DE BUENAVENTURA,9126,3.88179,-77.041527,POINT (-77.041527 3.88179),76,REGIONAL VALLE,CAUCA,19,GUAPI,318,-0.552481110737549,-1.1262125411373016,3.0831282535484954,0
CENTRO DEL DISENO Y MANUFACTURA DEL CUERO,9201,6.18026,-75.60519,POINT (-75.60519 6.18026),5,REGIONAL ANTIOQUIA,ANTIOQUIA,5,MEDELLIN,1,0.2203853549204808,-0.4630814213619531,2.123533970460555,2
CENTRO DE FORMACION EN DISENO CONFECCION Y MODA,9202,6.17996,-75.60518,POINT (-75.60518 6.17996),5,REGIONAL ANTIOQUIA,ANTIOQUIA,5,MEDELLIN,1,0.2202844791467283,-0.4630768045406985,2.1233191926792365,2
CENTRO PARA EL DESARROLLO DEL HABITAT Y LA CONSTRUCCION,9203,6.301,-75.568,POINT (-75.568 6.301),5,REGIONAL ANTIOQUIA,ANTIOQUIA,5,MEDELLIN,1,0.2609844913301581,-0.4459114630969763,2.1831436049879964,2
CENTRO DE TECNOLOGIA DE LA MANUFACTURA AVANZADA,9204,6.3016,-75.5686,POINT (-75.5686 6.3016),5,REGIONAL ANTIOQUIA,ANTIOQUIA,5,MEDELLIN,1,0.2611862428776634,-0.4461884723725634,2.18399173991112,2
CENTRO TECNOLOGICO DEL MOBILIARIO,9205,6.18073,-75.60519,POINT (-75.60519 6.18073),5,REGIONAL ANTIOQUIA,ANTIOQUIA,5,MEDELLIN,1,0.2205433936326934,-0.4630814213619531,2.1238591876581574,2
CENTRO TEXTIL Y DE GESTION INDUSTRIAL,9206,6.302,-75.5685,POINT (-75.5685 6.302),5,REGIONAL ANTIOQUIA,ANTIOQUIA,5,MEDELLIN,1,0.2613207439093337,-0.4461423041599645,2.1842145613469364,2
CENTRO NACIONAL COLOMBO ALEMAN,9207,10.941,-74.7825,POINT (-74.7825 10.941),8,REGIONAL ATLANTICO,ATLANTICO,8,BARRANQUILLA,1,1.8211964587055247,-0.0832601531442754,6.270383580770797,1
CENTRO INDUSTRIAL Y DE AVIACION,9208,10.942,-74.7827,POINT (-74.7827 10.942),8,REGIONAL ATLANTICO,ATLANTICO,8,BARRANQUILLA,1,1.8215327112847008,-0.0833524895694733,6.271399803074271,1
CENTRO DE TECNOLOGIAS PARA LA CONSTRUCCION Y LA MADERA,9209,4.5925,-74.0936,POINT (-74.0936 4.5925),11,REGIONAL DISTRITO CAPITAL,BOGOTA D.C.,11,BOGOTA,1,-0.313503040191569,0.2347926634393239,0.1204525217668757,2
CENTRO DE ELECTRICIDAD ELECTRONICA Y TELECOMUNICACIONES,9210,4.596,-74.1108,POINT (-74.1108 4.596),11,REGIONAL DISTRITO CAPITAL,BOGOTA D.C.,11,BOGOTA,1,-0.312326156164454,0.2268517308725672,0.1213690240547383,2
CENTRO DE GESTION INDUSTRIAL,9211,4.616575,-74.09186,POINT (-74.09186 4.616575),11,REGIONAL DISTRITO CAPITAL,BOGOTA D.C.,11,BOGOTA,1,-0.3054077593479135,0.235595990338518,0.096490933382364,2
CENTRO DE MANUFACTURA EN TEXTILES Y CUERO,9212,4.59613,-74.110877,POINT (-74.110877 4.59613),11,REGIONAL DISTRITO CAPITAL,BOGOTA D.C.,11,BOGOTA,1,-0.3122824433291613,0.2268161813488651,0.1212705159096806,2
CENTRO DE TECNOLOGIAS DEL TRANSPORTE,9213,4.5962,-74.1108,POINT (-74.1108 4.5962),11,REGIONAL DISTRITO CAPITAL,BOGOTA D.C.,11,BOGOTA,1,-0.312258905648619,0.2268517308725672,0.1211795362262117,2
CENTRO METALMECANICO,9214,4.597,-74.10988,POINT (-74.10988 4.597),11,REGIONAL DISTRITO CAPITAL,BOGOTA D.C.,11,BOGOTA,1,-0.3119899035852782,0.2272764784284605,0.1201286576966548,2
CENTRO DE MATERIALES Y ENSAYOS,9215,4.59618,-74.1109,POINT (-74.1109 4.59618),11,REGIONAL DISTRITO CAPITAL,BOGOTA D.C.,11,BOGOTA,1,-0.3122656307002023,0.2268055626599682,0.1212305341075417,2
CENTRO DE DISENO Y METROLOGIA,9216,4.61647,-74.091875,POINT (-74.091875 4.61647),11,REGIONAL DISTRITO CAPITAL,BOGOTA D.C.,11,BOGOTA,1,-0.3054430658687271,0.2355890651066262,0.0965967728498218,2
CENTRO PARA LA INDUSTRIA DE LA COMUNICACION GRAFICA,9217,4.61638,-74.0918,POINT (-74.0918 4.61638),11,REGIONAL DISTRITO CAPITAL,BOGOTA D.C.,11,BOGOTA,1,-0.3054733286008526,0.2356236912660722,0.0966694594998861,2
CENTRO PARA LA INDUSTRIA PETROQUIMICA,9218,10.406,-75.503,POINT (-75.503 10.406),13,REGIONAL BOLIVAR,BOLIVAR,13,CARTAGENA,1,1.641301328846512,-0.4159021249086571,5.872034230145461,1
CENTRO DE AUTOMATIZACION INDUSTRIAL,9219,5.0331,-75.45105,POINT (-75.45105 5.0331),17,REGIONAL CALDAS,CALDAS,17,MANIZALES,1,-0.1653501538067443,-0.3919177384642972,1.4161664141265244,2
CENTRO DE PROCESOS INDUSTRIALES Y CONSTRUCCION,9220,5.0333,-75.45103,POINT (-75.45103 5.0333),17,REGIONAL CALDAS,CALDAS,17,MANIZALES,1,-0.1652829032909093,-0.3919085048217813,1.4161924413369815,2
CENTRO DE TELEINFORMATICA Y PRODUCCION INDUSTRIAL,9221,2.44037,-76.613,POINT (-76.613 2.44037),19,REGIONAL CAUCA,CAUCA,19,POPAYAN,1,-1.0371623034130235,-0.9283692847399724,3.407703273012482,0
CENTRO INDUSTRIAL Y DE ENERGIAS ALTERNATIVAS,9222,11.515587,-72.869466,POINT (-72.869466 11.515587),44,REGIONAL GUAJIRA,LA GUAJIRA,44,RIOHACHA,1,2.014402819416368,0.7999534510365706,6.910028383568696,1
CENTRO DE DISENO E INNOVACION TECNOLOGICA INDUSTRIAL,9223,4.8936,-75.68,POINT (-75.68 4.8936),66,REGIONAL RISARALDA,RISARALDA,66,PEREIRA,1,-0.212257388601758,-0.4976198612060861,1.6183345636795914,2
CENTRO INDUSTRIAL DE MANTENIMIENTO INTEGRAL,9224,7.08077,-73.1668,POINT (-73.1668 7.08077),68,REGIONAL SANTANDER,BOGOTA D.C.,11,BOGOTA,1,0.5231841649940138,0.6626796577921737,2.5367689869004653,2
CENTRO INDUSTRIAL DEL DISENO Y LA MANUFACTURA,9225,7.0646,-73.08605,POINT (-73.08605 7.0646),68,REGIONAL SANTANDER,SANTANDER,68,BUCARAMANGA,1,0.5177469607887423,0.6999604894645847,2.5517700449883813,2
CENTRO DE INDUSTRIA Y CONSTRUCCION,9226,4.4317,-75.211,POINT (-75.211 4.4317),73,REGIONAL TOLIMA,CAQUETA,18,FLORENCIA,1,-0.3675724549230257,-0.2810909441242021,1.1727444265482527,2
CENTRO DE ELECTRICIDAD Y AUTOMATIZACION INDUSTRIAL - CEAI,9227,3.4678,-76.5,POINT (-76.5 3.4678),76,REGIONAL VALLE,CAUCA,19,SANTANDER DE QUILICHAO,698,-0.6916863159905077,-0.8761992045048927,2.7277701955993265,0
CENTRO DE LA CONSTRUCCION,9228,3.441,-76.506,POINT (-76.506 3.441),76,REGIONAL VALLE,VALLE DEL CAUCA,76,CALI,1,-0.7006978851124172,-0.8789692972607378,2.745406345151841,0
CENTRO DE DISENO TECNOLOGICO INDUSTRIAL,9229,3.4674,-76.5,POINT (-76.5 3.4674),76,REGIONAL VALLE,VALLE DEL CAUCA,76,CALI,1,-0.691820817022178,-0.8761992045048927,2.727952521580973,0
CENTRO NACIONAL DE ASISTENCIA TECNICA A LA INDUSTRIA - ASTIN,9230,3.467,-76.5,POINT (-76.5 3.467),76,REGIONAL VALLE,VALLE DEL CAUCA,76,CALI,1,-0.6919553180538482,-0.8761992045048927,2.7281348940255845,0
CENTRO PARA EL DESARROLLO TECNOLOGICO DE LA CONSTRUCCION Y LA INDUSTRIA,9231,4.57,-75.65,POINT (-75.65 4.57),63,REGIONAL QUINDIO,QUINDIO,63,ARMENIA,1,-0.3210687232230228,-0.4837693974268609,1.5842869058349278,2
CENTRO DE COMERCIO,9301,6.2548,-75.5753,POINT (-75.5753 6.2548),5,REGIONAL ANTIOQUIA,ANTIOQUIA,5,MEDELLIN,1,0.2454496221722397,-0.449281742616588,2.154815381883095,2
CENTRO DE COMERCIO Y SERVICIOS,9302,10.987672,-74.783447,POINT (-74.783447 10.987672),8,REGIONAL ATLANTICO,ATLANTICO,8,BARRANQUILLA,1,1.8368900390808145,-0.0836973661175713,6.316863796963885,1
CENTRO DE GESTION DE MERCADOS LOGISTICA Y TECNOLOGIAS DE LA INFORMACION,9303,4.6557,-74.066,POINT (-74.066 4.6557),11,REGIONAL DISTRITO CAPITAL,BOGOTA D.C.,11,BOGOTA,1,-0.2922518771876631,0.2475350901162072,0.0556245449419587,2
CENTRO DE COMERCIO Y SERVICIOS,9304,10.3736,-75.46,POINT (-75.46 10.3736),13,REGIONAL BOLIVAR,BOLIVAR,13,CARTAGENA,1,1.630406745281218,-0.3960497934917653,5.830230077792812,1
CENTRO DE COMERCIO Y SERVICIOS,9306,5.0332,-75.4508,POINT (-75.4508 5.0332),17,REGIONAL CALDAS,CALDAS,17,MANIZALES,1,-0.1653165285488268,-0.3918023179328064,1.4159457192985876,2
CENTRO DE COMERCIO Y SERVICIOS,9307,2.4402,-76.6127,POINT (-76.6127 2.4402),19,REGIONAL CAUCA,CAUCA,19,POPAYAN,1,-1.037219466351483,-0.9282307801021822,3.4075928644719293,0
CENTRO DE COMERCIO Y SERVICIOS,9308,4.8141,-75.7003,POINT (-75.7003 4.8141),66,REGIONAL RISARALDA,RISARALDA,66,PEREIRA,1,-0.2389894686462283,-0.5069920083633578,1.6315607558408565,2
CENTRO DE SERVICIOS EMPRESARIALES Y TURISTICOS,9309,7.133,-73.1198,POINT (-73.1198 7.133),68,REGIONAL SANTANDER,CESAR,20,SAN ALBERTO,710,0.5407466372043618,0.6843787177129579,2.602454387688669,2
CENTRO DE COMERCIO Y SERVICIOS,9310,4.432,-75.21,POINT (-75.21 4.432),73,REGIONAL TOLIMA,HUILA,41,NEIVA,1,-0.3674715791492729,-0.2806292619982257,1.1717017538605887,2
CENTRO DE GESTION TECNOLOGICA DE SERVICIOS,9311,3.46789,-76.5,POINT (-76.5 3.46789),76,REGIONAL VALLE,VALLE DEL CAUCA,76,CALI,1,-0.6916560532583819,-0.8761992045048927,2.7277291786575857,0
CENTRO DE SERVICIOS DE SALUD,9401,6.255,-75.57468,POINT (-75.57468 6.255),5,REGIONAL ANTIOQUIA,ANTIOQUIA,5,MEDELLIN,1,0.2455168726880746,-0.448995499698485,2.154526208334444,2
CENTRO DE SERVICIOS Y GESTION EMPRESARIAL,9402,6.256,-75.566,POINT (-75.566 6.256),5,REGIONAL ANTIOQUIA,ANTIOQUIA,5,MEDELLIN,1,0.2458531252672505,-0.4449880988450301,2.149200083752092,2
CENTRO DE FORMACION DE TALENTO HUMANO EN SALUD,9403,4.6316,-74.0635,POINT (-74.0635 4.6316),11,REGIONAL DISTRITO CAPITAL,BOGOTA D.C.,11,BOGOTA,1,-0.3003555643457983,0.2486892954311415,0.0798536786879606,2
CENTRO DE GESTION ADMINISTRATIVA,9404,4.603,-74.07999,POINT (-74.07999 4.603),11,REGIONAL DISTRITO CAPITAL,ANTIOQUIA,5,MEDELLIN,1,-0.3099723881102241,0.2410761571738321,0.1082951527077735,2
CENTRO DE SERVICIOS FINANCIEROS,9405,4.652,-74.0628,POINT (-74.0628 4.652),11,REGIONAL DISTRITO CAPITAL,ANTIOQUIA,5,ITAGUI,360,-0.2934960117306134,0.2490124729193276,0.0597129801634464,2
COMPLEJO TECNOLOGICO MINERO AGROEMPRESARIAL,9502,6.49275,-74.4178,POINT (-74.4178 6.49275),5,REGIONAL ANTIOQUIA,ANTIOQUIA,5,MEDELLIN,1,0.3254609233871035,0.0851153181984996,1.8149960612904916,2
CENTRO DE LA INNOVACION LA AGROINDUSTRIA Y LA AVIACION,9503,6.321175,-75.37142,POINT (-75.37142 6.321175),5,REGIONAL ANTIOQUIA,ANTIOQUIA,5,MEDELLIN,1,0.2677683871150284,-0.3551539907729775,2.069095422406853,2
CENTRO DE FORMACION EN ACTIVIDAD FISICA Y CULTURA,9508,4.61788,-74.1589,POINT (-74.1589 4.61788),11,REGIONAL DISTRITO CAPITAL,BOGOTA D.C.,11,BOGOTA,1,-0.304968949732089,0.2046448206132078,0.1273693228371729,2
CENTRO DE DESARROLLO AGROINDUSTRIAL Y EMPRESARIAL,9509,5.00638,-74.4755,POINT (-74.4755 5.00638),25,REGIONAL CUNDINAMARCA,BOGOTA D.C.,11,BOGOTA,1,-0.1743348227223198,0.0584762595297921,0.5000615906065922,2
CENTRO AGROECOLOGICO Y EMPRESARIAL,9510,4.3355,-74.3644,POINT (-74.3644 4.3355),25,REGIONAL CUNDINAMARCA,CUNDINAMARCA,25,ARBELAEZ,53,-0.3999199530397307,0.1097691437255179,0.4759180706802389,2
CENTRO DE LA TECNOLOGIA DEL DISENO Y LA PRODUCTIVIDAD EMPRESARIAL,9511,4.3022,-74.8055,POINT (-74.8055 4.3022),25,REGIONAL CUNDINAMARCA,CUNDINAMARCA,25,AGUA DE DIOS,1,-0.4111171639262822,-0.0938788420416793,0.8397259612516389,2
CENTRO DE BIOTECNOLOGIA AGROPECUARIA,9512,4.69448,-74.21733,POINT (-74.21733 4.69448),25,REGIONAL CUNDINAMARCA,BOGOTA D.C.,11,BOGOTA,1,-0.2792120021672284,0.1776687339925371,0.1462659198172984,2
CENTRO DE DESARROLLO AGROEMPRESARIAL,9513,4.849436,-74.049436,POINT (-74.049436 4.849436),25,REGIONAL CUNDINAMARCA,BOGOTA D.C.,11,BOGOTA,1,-0.2271076475084749,0.2551823928508443,0.1402628254100137,2
CENTRO PECUARIO Y AGROEMPRESARIAL,9515,5.476675,-74.668,POINT (-74.668 5.476675),17,REGIONAL CALDAS,ANTIOQUIA,5,APARTADO,45,-0.0161969159988718,-0.0303975497202378,0.9702959371372244,2
CENTRO TECNOLOGICO DE LA AMAZONIA,9516,1.6,-75.583,POINT (-75.583 1.6),18,REGIONAL CAQUETA,CAQUETA,18,FLORENCIA,1,-1.319738883374928,-0.4528366949865889,3.4585317694073576,0
CENTRO PARA LA BIODIVERSIDAD Y EL TURISMO DEL AMAZONAS,9517,-4.21095,-69.943075,POINT (-69.943075 -4.21095),91,REGIONAL AMAZONAS,AMAZONAS,91,LETICIA,1,-3.273685808336111,2.151015869348218,9.831033183654966,3
CENTRO AGROFORESTAL Y ACUICOLA ARAPAIMA,9518,0.49887,-76.505,POINT (-76.505 0.49887),86,REGIONAL PUTUMAYO,PUTUMAYO,86,MOCOA,1,-1.6899966858826947,-0.8785076151347615,4.864311681718182,0
CENTRO AGROINDUSTRIAL Y FORTALECIMIENTO EMPRESARIAL DE CASANARE,9519,5.328083,-72.393138,POINT (-72.393138 5.328083),85,REGIONAL CASANARE,CASANARE,85,YOPAL,1,-0.0661613592437512,1.0198655747375938,1.7886780157236326,2
CENTRO AGROEMPRESARIAL,9520,8.303351,-73.598824,POINT (-73.598824 8.303351),20,REGIONAL CESAR,CESAR,20,AGUACHICA,11,0.9342801794952512,0.4632218990003148,3.6233798081593656,2
CENTRO DE COMERCIO INDUSTRIA Y TURISMO DE CORDOBA,9523,8.752,-75.886,POINT (-75.886 8.752),23,REGIONAL CORDOBA,CORDOBA,23,MONTERIA,1,1.0851395628898617,-0.5927263791567576,4.429478185971795,1
CENTRO AGROEMPRESARIAL Y ACUICOLA,9524,10.895644,-72.828556,POINT (-72.828556 10.895644),44,REGIONAL GUAJIRA,LA GUAJIRA,44,RIOHACHA,1,1.805945386724431,0.8188408668101719,6.30840505895682,1
CENTRO DE DESARROLLO AGROEMPRESARIAL Y TURISTICO DEL HUILA,9526,2.3927,-75.889,POINT (-75.889 2.3927),41,REGIONAL HUILA,CAUCA,19,INZA,355,-1.0531914638623303,-0.5941114255346801,2.9455057104001643,0
CENTRO DE GESTION Y DESARROLLO SOSTENIBLE SURCOLOMBIANO,9528,1.85483,-76.0478,POINT (-76.0478 1.85483),41,REGIONAL HUILA,HUILA,41,ACEVEDO,6,-1.2340516386235778,-0.6674265471393762,3.4729659815350877,0
CENTRO DE LOGISTICA Y PROMOCION ECOTURISTICA DEL MAGDALENA,9529,11.23407,-74.20168,POINT (-74.20168 11.23407),47,REGIONAL MAGDALENA,MAGDALENA,47,SANTA MARTA,1,1.9197420020845544,0.1848940592640364,6.524358905463431,1
CENTRO DE GESTION Y DESARROLLO AGROINDUSTRIAL DE ARAUCA,9530,7.09375,-70.757672,POINT (-70.757672 7.09375),81,REGIONAL ARAUCA,ARAUCA,81,ARAUCA,1,0.5275487234717146,1.7749309945760436,4.081944102273329,2
CENTRO DE INDUSTRIA Y SERVICIOS DEL META,9532,4.127,-73.64,POINT (-73.64 4.127),50,REGIONAL META,META,50,VILLAVICENCIO,1,-0.4700286157978695,0.4442116757811995,0.7264158588577224,2
CENTRO SUR COLOMBIANO DE LOGISTICA INTERNACIONAL,9534,0.8296,-77.665,POINT (-77.665 0.8296),52,REGIONAL NARINO,NARINO,52,PASTO,1,-1.578787870371907,-1.41405888126479,5.289131777522662,0
CENTRO INTERNACIONAL DE PRODUCCION LIMPIA - LOPE,9536,1.2117,-77.254,POINT (-77.254 1.2117),52,REGIONAL NARINO,NARINO,52,PASTO,1,-1.450305759868862,-1.2243075274894104,4.729717168076757,0
CENTRO DE LA INDUSTRIA LA EMPRESA Y LOS SERVICIOS,9537,7.8991,-72.5038,POINT (-72.5038 7.8991),54,REGIONAL NORTE DE SANTANDER,NORTE DE SANTANDER,54,CUCUTA,1,0.7983497381108852,0.9687749073130392,3.552918919705319,2
CENTRO DE COMERCIO Y TURISMO,9538,4.54,-75.686,POINT (-75.686 4.54),63,REGIONAL QUINDIO,ANTIOQUIA,5,MEDELLIN,1,-0.3311563005982947,-0.5003899539619312,1.623033271378013,2
CENTRO INDUSTRIAL Y DEL DESARROLLO TECNOLOGICO,9540,7.0659,-73.851,POINT (-73.851 7.0659),68,REGIONAL SANTANDER,ANTIOQUIA,5,YONDO,893,0.5181840891416706,0.3467967472006528,2.3652473464735144,2
CENTRO AGROTURISTICO,9541,6.5587,-73.141388,POINT (-73.141388 6.5587),68,REGIONAL SANTANDER,SANTANDER,68,ARATOCA,51,0.3476367809837425,0.6744119239774239,2.068824300066101,2
CENTRO DE LA INNOVACION LA TECNOLOGIA Y LOS SERVICIOS,9542,9.3028,-75.38,POINT (-75.38 9.3028),70,REGIONAL SUCRE,SUCRE,70,SINCELEJO,1,1.2703474834998512,-0.3591152234138334,4.7744624032449945,1
CENTRO DE TECNOLOGIAS AGROINDUSTRIALES,9543,4.7457,-75.9137,POINT (-75.9137 4.7457),76,REGIONAL VALLE,CHOCO,27,SAN JOSE DEL PALMAR,660,-0.2619891450618478,-0.6055149740462464,1.842026867339348,2
CENTRO DE BIOTECNOLOGIA INDUSTRIAL,9544,3.5189,-76.3019,POINT (-76.3019 3.5189),76,REGIONAL VALLE,CAUCA,19,PUERTO TEJADA,573,-0.6745038091946282,-0.7847399753494136,2.528548283106337,0
CENTRO AGROEMPRESARIAL Y TURISTICO DE LOS ANDES,9545,6.701066,-72.735,POINT (-72.735 6.701066),68,REGIONAL SANTANDER,BOYACA,15,BOAVITA,97,0.3955077156706739,0.8620339997878133,2.397484449241748,2
CENTRO DE GESTION AGROEMPRESARIAL DEL ORIENTE,9546,6.00972,-73.669,POINT (-73.669 6.00972),68,REGIONAL SANTANDER,SANTANDER,68,BUCARAMANGA,1,0.1630408400678526,0.4308228941279506,1.359809780226633,2
CENTRO AGROEMPRESARIAL Y DESARROLLO PECUARIO DEL HUILA,9525,2.200617,-75.628107,POINT (-75.628107 2.200617),41,REGIONAL HUILA,HUILA,41,AGRADO,13,-1.1177798680281412,-0.473661790642906,2.9535557895760145,0
CENTRO AGROINDUSTRIAL Y PESQUERO DE LA COSTA PACIFICA,9535,1.686375,-78.760088,POINT (-78.760088 1.686375),52,REGIONAL NARINO,NARINO,52,BARBACOAS,79,-1.2906950668486248,-1.9196414372335744,5.579115116787692,0
CENTRO AGROPECUARIO Y DE BIOTECNOLOGIA EL PORVENIR,9115,8.57089,-75.949802,POINT (-75.949802 8.57089),23,REGIONAL CORDOBA,CORDOBA,23,MONTERIA,1,1.024240858275346,-0.6221826221581653,4.292422528515106,1
CENTRO AGROPECUARIO Y DE SERVICIOS AMBIENTALES JIRI - JIRIMO,9548,1.249076,-70.235523,POINT (-70.235523 1.249076),97,REGIONAL VAUPES,VAUPES,97,MITU,1,-1.4377379834695905,2.015997854971324,5.167540377520529,3
CENTRO AMBIENTAL Y ECOTURISTICO DEL NORORIENTE AMAZONICO,9547,3.87584,-67.919917,POINT (-67.919917 3.87584),94,REGIONAL GUAINIA,GUAINIA,94,PTO INIRIDA,1,-0.5544818135836446,3.085071755969841,6.208511694801666,3
CENTRO DE FORMACION AGROINDUSTRIAL,9116,2.612561,-75.361435,POINT (-75.361435 2.612561),41,REGIONAL HUILA,HUILA,41,NEIVA,1,-0.979262635552176,-0.3505440947451254,2.4629431288493038,0
CENTRO DE FORMACION MINERO AMBIENTAL,9127,7.584644,-74.800809,POINT (-74.800809 7.584644),5,REGIONAL ANTIOQUIA,ANTIOQUIA,5,CAUCASIA,154,0.6926130970736032,-0.0917130911887373,2.9646234832128338,2
CENTRO DE FORMACION TURISTICA GENTE DE MAR Y DE SERVICIOS,9539,12.57813,-81.699558,POINT (-81.699558 12.57813),88,REGIONAL SAN ANDRES,SAN ANDRES Y PROVIDENCIA,88,SAN ANDRES ISLAS,1,2.3716856436514804,-3.2767421960708334,10.95770849586098,1
CENTRO DE GESTION ADMINISTRATIVA Y FORTALECIMIENTO EMPRESARIAL,9305,5.532872,-73.364538,POINT (-73.364538 5.532872),15,REGIONAL BOYACA,BOYACA,15,TUNJA,1,0.0026994701930664,0.5713875575662952,1.0844243015665085,2
CENTRO DE OPERACION Y MANTENIMIENTO MINERO,9521,10.471546,-73.257896,POINT (-73.257896 10.471546),20,REGIONAL CESAR,BOLIVAR,13,CARTAGENA,1,1.663341340401164,0.6206222628444285,5.817787856301741,1
CENTRO DE PRODUCCION Y TRANSFORMACION AGROINDUSTRIAL DE LA ORINOQUIA,9531,6.182762,-67.486019,POINT (-67.486019 6.182762),99,REGIONAL VICHADA,VICHADA,99,PUERTO CARRENO,1,0.2212266588735787,3.2853947070657767,6.7484241950995525,3
CENTRO INDUSTRIAL DE MANTENIMIENTO Y MANUFACTURA,9514,5.755345,-72.90827,POINT (-72.90827 5.755345),15,REGIONAL BOYACA,BOYACA,15,TUNJA,1,0.0775065902400276,0.7820383378202698,1.5636252722199786,2
CENTRO INDUSTRIAL Y DE DESARROLLO EMPRESARIAL DE SOACHA,9232,4.585575,-74.219481,POINT (-74.219481 4.585575),25,REGIONAL CUNDINAMARCA,CUNDINAMARCA,25,GRANADA,312,-0.3158315893023609,0.1766756557395677,0.1936028821737933,2
CENTRO MINERO,9111,5.730046,-72.8933,POINT (-72.8933 5.730046),15,REGIONAL BOYACA,BOGOTA D.C.,11,BOGOTA,1,0.0689997362394607,0.7889497192461054,1.5581362071770275,2
COMPLEJO TECNOLOGICO PARA LA GESTION AGROEMPRESARIAL,9501,7.996571,-75.196427,POINT (-75.196427 7.996571),5,REGIONAL ANTIOQUIA,ANTIOQUIA,5,CACERES,120,0.8311246132557224,-0.2743628505023813,3.472652138405169,2
COMPLEJO TECNOLOGICO TURISTICO Y AGROINDUSTRIAL DEL OCCIDENTE ANTIOQUENO,9549,6.55898,-75.829196,POINT (-75.829196 6.55898),5,REGIONAL ANTIOQUIA,ANTIOQUIA,5,MEDELLIN,1,0.3477309317059118,-0.5665009876729217,2.550052521579894,2
CENTRO AGROFORESTAL Y ACUICOLA ARAPAIMA,9518,0.505059,-76.501705,POINT (-76.501705 0.505059),86,REGIONAL PUTUMAYO,PUTUMAYO,86,MOCOA,1,-1.687915618670176,-0.8769863725296793,4.8573044049664,0
CENTRO DE FORMACION TURISTICA GENTE DE MAR Y DE SERVICIOS,9539,12.576799,-81.701032,POINT (-81.701032 12.576799),88,REGIONAL SAN ANDRES,SAN ANDRES Y PROVIDENCIA,88,SAN ANDRES ISLAS,1,2.371238091468597,-3.27742271552452,10.957779116473596,1
CENTRO PARA LA BIODIVERSIDAD Y EL TURISMO DEL AMAZONAS,9517,-4.210806,-69.945538,POINT (-69.945538 -4.210806),91,REGIONAL AMAZONAS,AMAZONAS,91,LETICIA,1,-3.273637387964709,2.149878746271941,9.829868307311145,3
CENTRO AMBIENTAL Y ECOTURISTICO DEL NORORIENTE AMAZONICO,9547,3.874345,-67.921817,POINT (-67.921817 3.874345),94,REGIONAL GUAINIA,GUAINIA,94,PTO INIRIDA,1,-0.5549845111895123,3.084194559930488,6.206830312044464,3
"CENTRO DE DESARROLLO AGROINDUSTRIAL, TURISTICO Y TECNOLOGICO DEL GUAVIARE",9533,2.561174,-72.642749,POINT (-72.642749 2.561174),95,REGIONAL GUAVIARE,META,50,PUERTO CONCORDIA,450,-0.9965416468382792,0.9046246375910574,2.5815712756530718,2
CENTRO DE PRODUCCION Y TRANSFORMACION AGROINDUSTRIAL DE LA ORINOQUIA,9531,6.181997,-67.485291,POINT (-67.485291 6.181997),99,REGIONAL VICHADA,VICHADA,99,PUERTO CARRENO,1,0.2209694256505092,3.285730811653484,6.748967893292276,3
